{
  "schemaVersion": "1.0",
  "catalogVersion": "1.0.0",
  "generatedForBaseline": "1.0.0",
  "sanitized": true,
  "syntheticIdNamespace": "00000000-0000-4000-8000-000000000000",
  "notes": "Fixtures are synthetic and contain no tenant-derived identifiers, UPNs, secrets, tokens, or customer configuration. example.invalid and RFC 5737 documentation IP space are used where text/network data is required.",
  "workloads": [
    {
      "module": "Groups",
      "moduleFile": "Workloads/DER.Groups.psm1",
      "graphMode": "Automatic",
      "coverageMode": "mocked-flow",
      "interactions": [
        {
          "method": "GET",
          "apiVersion": "v1.0",
          "routePattern": "^groups(?:\\?|/)",
          "responseFixture": "Graph/groups.customerCollision.json"
        },
        {
          "method": "POST",
          "apiVersion": "v1.0",
          "routePattern": "^groups$",
          "responseFixture": "Graph/groups.created.json"
        }
      ]
    },
    {
      "module": "EntraDevice",
      "moduleFile": "Workloads/DER.EntraDevice.psm1",
      "graphMode": "Automatic",
      "coverageMode": "mocked-flow",
      "interactions": [
        {
          "method": "GET",
          "apiVersion": "v1.0",
          "routePattern": "^policies/deviceRegistrationPolicy$",
          "responseFixture": "Graph/deviceRegistrationPolicy.current.json"
        },
        {
          "method": "PUT",
          "apiVersion": "v1.0",
          "routePattern": "^policies/deviceRegistrationPolicy$",
          "responseFixture": "Graph/deviceRegistrationPolicy.current.json"
        }
      ]
    },
    {
      "module": "Enrollment",
      "moduleFile": "Workloads/DER.Enrollment.psm1",
      "graphMode": "Automatic",
      "coverageMode": "mocked-flow",
      "interactions": [
        {
          "method": "GET",
          "apiVersion": "v1.0",
          "routePattern": "^deviceManagement/deviceEnrollmentConfigurations",
          "responseFixture": "Graph/collection.empty.json"
        },
        {
          "method": "POST",
          "apiVersion": "v1.0",
          "routePattern": "^deviceManagement/deviceEnrollmentConfigurations(?:$|/)",
          "responseFixture": "Graph/enrollment.restriction.created.json"
        },
        {
          "method": "GET",
          "apiVersion": "beta",
          "routePattern": "^policies/mobileDeviceManagementPolicies",
          "responseFixture": "Graph/collection.empty.json"
        },
        {
          "method": "POST",
          "apiVersion": "beta",
          "routePattern": "^policies/mobileDeviceManagementPolicies/.+/includedGroups/\\$ref$"
        },
        {
          "method": "DELETE",
          "apiVersion": "beta",
          "routePattern": "^policies/mobileDeviceManagementPolicies/.+/includedGroups/.+/\\$ref$"
        }
      ]
    },
    {
      "module": "Autopilot",
      "moduleFile": "Workloads/DER.Autopilot.psm1",
      "graphMode": "Automatic",
      "coverageMode": "pure+mock-contract",
      "interactions": [
        {
          "method": "GET",
          "apiVersion": "beta",
          "routePattern": "^deviceManagement/windowsAutopilotDeploymentProfiles",
          "responseFixture": "Graph/collection.empty.json"
        },
        {
          "method": "POST",
          "apiVersion": "beta",
          "routePattern": "^deviceManagement/windowsAutopilotDeploymentProfiles",
          "responseFixture": "Graph/configurationPolicy.created.json"
        },
        {
          "method": "GET",
          "apiVersion": "v1.0",
          "routePattern": "^deviceManagement/deviceEnrollmentConfigurations",
          "responseFixture": "Graph/collection.empty.json"
        },
        {
          "method": "POST",
          "apiVersion": "v1.0",
          "routePattern": "^deviceManagement/deviceEnrollmentConfigurations",
          "responseFixture": "Graph/enrollment.restriction.created.json"
        }
      ]
    },
    {
      "module": "Compliance",
      "moduleFile": "Workloads/DER.Compliance.psm1",
      "graphMode": "Automatic",
      "coverageMode": "mocked-flow",
      "interactions": [
        {
          "method": "GET",
          "apiVersion": "beta",
          "routePattern": "^deviceManagement/deviceCompliancePolicies",
          "responseFixture": "Graph/collection.empty.json"
        },
        {
          "method": "POST",
          "apiVersion": "beta",
          "routePattern": "^deviceManagement/deviceCompliancePolicies",
          "responseFixture": "Graph/deviceConfiguration.created.json"
        }
      ]
    },
    {
      "module": "BitLocker",
      "moduleFile": "Workloads/DER.BitLocker.psm1",
      "graphMode": "Automatic",
      "coverageMode": "pure+mock-contract",
      "interactions": [
        {
          "method": "GET",
          "apiVersion": "beta",
          "routePattern": "^deviceManagement/configurationPolicies",
          "responseFixture": "Graph/collection.empty.json"
        },
        {
          "method": "POST",
          "apiVersion": "beta",
          "routePattern": "^deviceManagement/configurationPolicies",
          "responseFixture": "Graph/configurationPolicy.created.json"
        }
      ]
    },
    {
      "module": "LAPS",
      "moduleFile": "Workloads/DER.LAPS.psm1",
      "graphMode": "Automatic",
      "coverageMode": "pure+mock-contract",
      "interactions": [
        {
          "method": "GET",
          "apiVersion": "v1.0",
          "routePattern": "^policies/deviceRegistrationPolicy$",
          "responseFixture": "Graph/deviceRegistrationPolicy.current.json"
        },
        {
          "method": "PUT",
          "apiVersion": "v1.0",
          "routePattern": "^policies/deviceRegistrationPolicy$",
          "responseFixture": "Graph/deviceRegistrationPolicy.current.json"
        },
        {
          "method": "GET",
          "apiVersion": "beta",
          "routePattern": "^deviceManagement/configurationPolicies",
          "responseFixture": "Graph/collection.empty.json"
        },
        {
          "method": "POST",
          "apiVersion": "beta",
          "routePattern": "^deviceManagement/configurationPolicies",
          "responseFixture": "Graph/configurationPolicy.created.json"
        }
      ]
    },
    {
      "module": "Defender",
      "moduleFile": "Workloads/DER.Defender.psm1",
      "graphMode": "Automatic",
      "coverageMode": "pure+mock-contract",
      "interactions": [
        {
          "method": "GET",
          "apiVersion": "beta",
          "routePattern": "^deviceManagement/configurationPolicies",
          "responseFixture": "Graph/collection.empty.json"
        },
        {
          "method": "POST",
          "apiVersion": "beta",
          "routePattern": "^deviceManagement/configurationPolicies",
          "responseFixture": "Graph/configurationPolicy.created.json"
        }
      ]
    },
    {
      "module": "ASR",
      "moduleFile": "Workloads/DER.ASR.psm1",
      "graphMode": "Automatic",
      "coverageMode": "pure+mock-contract",
      "interactions": [
        {
          "method": "GET",
          "apiVersion": "beta",
          "routePattern": "^deviceManagement/configurationPolicies",
          "responseFixture": "Graph/collection.empty.json"
        },
        {
          "method": "POST",
          "apiVersion": "beta",
          "routePattern": "^deviceManagement/configurationPolicies",
          "responseFixture": "Graph/configurationPolicy.created.json"
        }
      ]
    },
    {
      "module": "Firewall",
      "moduleFile": "Workloads/DER.Firewall.psm1",
      "graphMode": "Automatic",
      "coverageMode": "pure+mock-contract",
      "interactions": [
        {
          "method": "GET",
          "apiVersion": "beta",
          "routePattern": "^deviceManagement/configurationPolicies",
          "responseFixture": "Graph/collection.empty.json"
        },
        {
          "method": "POST",
          "apiVersion": "beta",
          "routePattern": "^deviceManagement/configurationPolicies",
          "responseFixture": "Graph/configurationPolicy.created.json"
        }
      ]
    },
    {
      "module": "Configuration",
      "moduleFile": "Workloads/DER.Configuration.psm1",
      "graphMode": "Automatic",
      "coverageMode": "pure+mock-contract",
      "interactions": [
        {
          "method": "GET",
          "apiVersion": "beta",
          "routePattern": "^deviceManagement/configurationSettings",
          "responseFixture": "Graph/collection.empty.json"
        },
        {
          "method": "POST",
          "apiVersion": "beta",
          "routePattern": "^deviceManagement/configurationPolicies",
          "responseFixture": "Graph/configurationPolicy.created.json"
        }
      ]
    },
    {
      "module": "AuthenticationMethods",
      "moduleFile": "Workloads/DER.AuthenticationMethods.psm1",
      "graphMode": "Automatic",
      "coverageMode": "pure+mock-contract",
      "interactions": [
        {
          "method": "GET",
          "apiVersion": "v1.0",
          "routePattern": "^policies/authenticationMethodsPolicy/authenticationMethodConfigurations/",
          "responseFixture": "Graph/authMethods.authenticator.disabled.json"
        },
        {
          "method": "PATCH",
          "apiVersion": "v1.0",
          "routePattern": "^policies/authenticationMethodsPolicy/authenticationMethodConfigurations/",
          "responseFixture": "Graph/authMethods.authenticator.disabled.json"
        }
      ]
    },
    {
      "module": "NamedLocations",
      "moduleFile": "Workloads/DER.NamedLocations.psm1",
      "graphMode": "Automatic",
      "coverageMode": "pure+mock-contract",
      "interactions": [
        {
          "method": "GET",
          "apiVersion": "v1.0",
          "routePattern": "^identity/conditionalAccess/namedLocations",
          "responseFixture": "Graph/collection.empty.json"
        },
        {
          "method": "POST",
          "apiVersion": "v1.0",